"veranstid","verart","verartid","aikz","veranstnr","veranstnrint","ktxt","dtxt","ltxt","sws","semester","erwartteilnehmer","teilnehmermax","druck_vvz","zeitstempel","lehrmethoden","voraussetzung","verweise","pruefungsstoff","credits","kommentar","bemerkung","literatur","hyperlink","uebernrhythm","veranststatusid","pruefmoegl","freigabe","publish","belegpflicht","geschl","unterrsprache","praesenzzeit","art_praesenzzeit","ssz","studienjahr","kosten","externperson","externinst","evalartid","externid","fachuebergreifend_kz","curricular_kz","sichtbar","verformatid"
191451,,113,A,"54148               ",,,Modul 6a (Bachelor; SU): Konzeptionen und Theorien des Sachunterrichts und seiner Didaktik - Vertiefung Didaktik Sachunterricht | SE Historische und gegenwärtige Konzeptionen des Sachunterrichts und seiner Didaktik,,2.0,20221,,,J,2022-01-14 08:28:48.155,,,,,,,,,,1,4,,N,,J,,1,,,,,,,,,,,,,2
191448,,113,A,"54152               ",,,"Modul 1 (Bachelor; ÜWP): Kinder und Kindheiten | Seminar ""Entwicklung von Kindheit""",,2.0,20221,,,J,2022-01-14 08:26:53.333,,,,,,,,,,2,4,,N,,J,,1,,,,,,,,,,,,,1
191444,,342,A,"54154               ",,,"Modul 2 (Bachelor; SU): Konzeptionelle Grundlagen des Sachunterrichts und seiner Didaktik | Wahlseminar ""Umwelt erschließen als Aufgabe des Sachunterrichts""",,2.0,20221,,,J,2022-01-27 15:35:58.563,,,,,,,,,,2,4,,N,,J,,1,,,,,,,,,,,,,3
191449,,113,A,"54165               ",,,"Modul 1 (Bachelor; ÜWP): Kinder und Kindheiten | Seminar ""Bildungsanforderungen und Kindheiten""",,2.0,20221,,,J,2022-01-14 08:24:48.357,,,,,,,,,,2,4,,N,,J,,1,,,,,,,,,,,,,1
191447,,401,A,,,,Abschlussmodul (Bachelor) | Abschlusscolloquium,,2.0,20221,,,J,2022-01-25 09:04:20.711,,,,,,,,,,2,4,,N,,J,,1,,,,,,,,,,,,,3
192775,,113,A,"54832               ",,,Grundlagen der Didaktik im Förderschwerpunkt Sprache,,2.0,20221,,,J,2022-02-24 13:59:33.853,,,,,,,,,,1,4,,N,,J,,1,,,,,,,,,,,,,1
193363,,401,A,"532848              ",,,Forschungskolloquium für Examenskandidat/innen und Doktorand/innen,,2.0,20221,,,J,2022-02-18 22:27:46.673,,,,,,,,,,0,4,,J,,N,,1,,,,,,,,,,,,,2
190493,,325,A,"5230016Ü            ",,,Einführung in die skandinavistische Literaturwissenschaft,,2.0,20221,,,J,2022-01-25 12:47:56.682,,,,,,,,,,2,4,,N,,J,,1,,,,,,,,,,,,,3
190492,,325,A,"5230020Ü            ",,,Einführung in die skandinavistische Sprachwissenschaft,,2.0,20221,,,J,2022-01-25 12:51:31.493,,,,,,,,,,,4,,N,,J,,1,,,,,,,,,,,,,3
193895,,401,A,"2112137             ",,,Projekt der Masterarbeit,,1.0,20221,,,J,2022-01-25 13:52:07.350,,,,,,,,,,2,4,,J,,N,,1,,,,,,,,,,,,,1
192148,,374,A,"5240435             ",,,Ich hasse Schreiben. Aber ich liebe den fertigen Text,,2.0,20221,,,J,2021-12-09 16:59:24.421,,,,,,,,,,0,4,,N,,J,,1,,,,,,,,,,,,,1
190408,,4,A,"603001              ",,,"Quellen zur Vorlesung ""Christentumsgeschichte II: Mittelalter"" (GS/HS - H 235, BA[V]HTmL)",,1.0,20221,,,J,2022-03-14 10:01:00.988,,,,,,,,,https://moodle.hu-berlin.de/enrol/index.php?id=111026,,4,,N,,N,,1,,,,,,,,,,,,J,1
190488,,330,A,"5230003             ",,,Basiskompetenz,,2.0,20221,,,J,2022-01-25 10:52:45.656,,,,,,,,,,1,4,,N,,J,,1,,,,,,,,,,,,,3
190487,,350,A,"5230002Ü            ",,,Einführung ins Altnordische,,2.0,20221,,,J,2022-01-25 10:51:36.609,,,,,,,,,,,4,,N,,J,,1,,,,,,,,,,,,,3
190484,,113,A,"5230080             ",,,Von der Frage zum Text. Techniken und Taktiken historischer und kulturwissenschaftlicher Analyse,,2.0,20221,,,J,2022-01-25 13:27:09.956,,,,,,,,,,,4,,J,,J,,1,,,,,,,,,,,,,3
190457,,236,A,"5230019             ",,,Einführung in die skandinavistische Sprachwissenschaft,,2.0,20221,,,J,2022-01-25 12:49:41.495,,,,,,,,,,2,4,,J,,J,,1,,,,,,,,,,,,,3
190455,,387,A,"5230022             ",,,Isländisch 4,,4.0,20221,,,J,2022-01-25 12:52:42.313,,,,,,,,,,2,4,,N,,J,,17,,,,,,,,,,,,,3
190453,,4,A,"5230045             ",,,Aktuelle debatter i Norge,,2.0,20221,,,J,2022-01-25 13:17:21.214,,,,,,,,,,2,4,,N,,J,,16,,,,,,,,,,,,,3
190452,,4,A,"5230048             ",,,Übungen zur schwedischen Grammatik,,2.0,20221,,,J,2022-01-25 13:19:05.300,,,,,,,,,,2,4,,N,,J,,1,,,,,,,,,,,,,3
190449,,374,A,"5230038             ",,,Einführung in die journalistische Praxis,,2.0,20221,,,J,2022-01-25 13:07:04.940,,,,,,,,,,,4,,N,,J,,1,,,,,,,,,,,,,3
190448,,4,A,"5230068             ",,,Tekstproduktion,,2.0,20221,,,J,2022-01-25 13:22:57.350,,,,,,,,,,2,4,,N,,J,,14,,,,,,,,,,,,,3
190447,,4,A,"5230071             ",,,Tekstproduksjon,,2.0,20221,,,J,2022-01-25 13:24:03.545,,,,,,,,,,2,4,,N,,J,,16,,,,,,,,,,,,,3
190446,,4,A,"5230072             ",,,Facktext och textreception,,2.0,20221,,,J,2022-01-25 13:24:23.552,,,,,,,,,,2,4,,N,,J,,5,,,,,,,,,,,,,3
190445,,4,A,"5230070             ",,,Tekstresepsjon,,2.0,20221,,,J,2022-01-25 13:23:42.313,,,,,,,,,,2,4,,N,,J,,16,,,,,,,,,,,,,3
190444,,4,A,"5230069             ",,,Tekstreception,,2.0,20221,,,J,2022-01-25 13:23:19.563,,,,,,,,,,,4,,N,,J,,14,,,,,,,,,,,,,3
190443,,113,A,"5230097             ",,,"Der ""Norden"" von der Antike bis heute",,2.0,20221,,,J,2022-02-01 09:49:18.508,,,,,,,,,,,4,,N,,N,,1,,,,,,,,,,,,,2
190542,,4,A,"5230073             ",,,Textproduktion: Språk i kontext,,2.0,20221,,,J,2022-01-25 13:24:41.557,,,,,,,,,,2,4,,N,,J,,5,,,,,,,,,,,,,3
191459,,113,A,"54155               ",,,"Modul 1 (Master; SU): Sachunterricht in Forschung und Unterricht | Pflichtseminar ""Lernen und Lehren im Sachunterricht""",,2.0,20221,,,J,2022-01-06 16:25:17.687,,,,,,,,,,1,4,,N,,J,,1,,,,,,,,,,,,,3
191458,,113,A,"54158               ",,,Modul Fachpraktikum (Master) | Pflichtseminar Praktikumsvorbereitung,,2.0,20221,,,J,2022-01-06 16:25:17.701,,,,,,,,,,2,4,,N,,J,,1,,,,,,,,,,,,,3
191457,,401,A,"54159               ",,,Abschlussmodul (Master) | Abschlusscolloquium,,2.0,20221,,,J,2022-01-06 14:52:41.885,,,,,,,,,,2,4,,N,,J,,1,,,,,,,,,,,,,2
193896,,236,A,CUB882              ,,,"Hör-, Sprach- und Stimmstörungen",,2.0,20221,,,J,2022-02-24 13:53:13.593,,,,,,,,,,1,4,,N,,J,,1,,,,,,,,,,,,,1
192776,,113,A,"54890               ",,,Vertiefte Bearbeitung von didaktisch-methodischen und diagnostischen Fragestellungen im Förderschwerpunkt Sprache,,2.0,20221,,,J,2022-02-24 13:57:03.811,,,,,,,,,,2,4,,J,,J,,1,,,,,,,,,,,,,1
194852,,4,A,"33145161            ",,,Ausgewählte Themen der Finanz- und Versicherungsmathematik (M26): Interest rate modelling and derivative pricing,,1.0,20221,,,J,2022-02-28 08:52:25.580,,,,,,,,,,,4,,N,,J,,1,,,,,,,,,,,,J,1
193365,,113,A,"532823              ",,,"Figuren des Nehmens. Parasiten, Pirat:innen und Besetzer:innen",,2.0,20221,,,J,2022-02-28 20:45:28.596,,,,,,,,,,0,4,,N,,N,,1,,,,,,,,,,,,J,1
190535,,330,A,"5230055             ",,,Aktenzeichen &#491; ð þ &#8211; Tutorium Altnordisch,,2.0,20221,,,J,2022-01-25 13:21:55.740,,,,,,,,,,,4,,N,,J,,1,,,,,,,,,,,,,3
190533,,4,A,"5230029             ",,,Verfemte feministische Forschung sichtbar machen,,2.0,20221,,,J,2021-12-27 10:57:45.146,,,,,,,,,,,4,,J,,J,,1,,,,,,,,,,,,,3
190531,,387,A,"5230010             ",,,Schwedisch 2,,4.0,20221,,,J,2022-01-25 10:58:07.630,,,,,,,,,,2,4,,N,,J,,5,,,,,,,,,,,,,3
192152,,4,A,"5240437             ",,,Kreatives Schreiben,,2.0,20221,,,J,2021-12-09 17:11:11.716,,,,,,,,,,0,4,,N,,J,,3,,,,,,,,,,,,,1
190409,,113,A,"60309               ",,,"Autorität und »leadership« in der spätantiken Kirche (HS - H 430/431, MEd A, B, C, MRC-V1a, V1g, (71)ÜWB, FM3, VM3a, Vm3c, BA: V3a, V3b, V3c, V3d)",,2.0,20221,,,J,2022-03-14 10:01:54.891,,,,,,,,,https://moodle.hu-berlin.de/enrol/index.php?id=111027,,4,,N,,N,,1,,,,,,,,,,,,J,1
192800,,412,A,"51483               ",,,Offenes Forschungskolloquium Digital History,,3.0,20221,,,J,2022-02-07 08:54:25.203,,,,,,,,,,0,4,,N,,J,,1,,,,,,,,,,,,,2
192801,,412,A,"51484               ",,,Forschungskolloquium zur Geschichte Osteuropas,,3.0,20221,,,J,2022-01-31 18:09:28.105,,,,,,,,,,0,4,,N,,J,,1,,,,,,,,,,,,,1
190537,,113,A,"5230092E            ",,,"Kreativität im wissenschaftlichen Arbeiten (""Oberseminar"")",,2.0,20221,,,J,2022-01-25 13:39:10.373,,,,,,,,,,,4,,J,,J,,1,,,,,,,,,,,,,3
190530,,4,A,"5230009             ",,,Grammatik des Norwegischen,,2.0,20221,,,J,2022-01-25 10:56:55.647,,,,,,,,,,2,4,,N,,J,,1,,,,,,,,,,,,,3
190529,,387,A,"5230008             ",,,Norwegisch 2,,4.0,20221,,,J,2022-01-25 10:56:25.421,,,,,,,,,,2,4,,N,,J,,1,,,,,,,,,,,,,3
190528,,4,A,"5230007             ",,,Grammatik des Dänischen,,2.0,20221,,,J,2022-01-25 10:55:58.630,,,,,,,,,,2,4,,N,,J,,1,,,,1,,,,,,,,,3
190524,,394,A,"5230028             ",,,Verfemte feministische Forschung - Kann eine Frau in Deutschland Privatdozentin werden?,,2.0,20221,,,J,2021-12-27 10:34:10.268,,,,,,,,,,,4,,N,,J,,1,,,,,,,,,,,,,3
190522,,4,A,"5230031             ",,,Werkzeuge für Sprachrecherche: Die skandinavischen Sprachen unter der Lupe,,2.0,20221,,,J,2022-01-25 13:01:52.910,,,,,,,,,,,4,,N,,J,,1,,,,,,,,,,,,,3
190521,,113,A,"5230096             ",,,Making Myth Visible. Aesthetics of Norse Mythology between National Romanticism and Contemporary Receptions,,2.0,20221,,,J,2022-01-25 13:42:00.747,,,,,,,,,,,4,,J,,N,,1,,,,,,,,,,,,,3
190519,,4,A,"5230035             ",,,Schreiblabor,,2.0,20221,,,J,2022-01-25 13:05:54.562,,,,,,,,,,,4,,N,,J,,1,,,,,,,,,,,,,3
190517,,236,A,"5230015             ",,,Einblicke in die skandinavische Literaturgeschichte,,2.0,20221,,,J,2022-01-25 11:01:47.702,,,,,,,,,,2,4,,J,,J,,1,,,,,,,,,,,,,3
190515,,394,A,"5230026A            ",,,Naturkulturen. Natur in Nordnorwegen und Sápmi,,2.0,20221,,,J,2022-02-02 13:11:17.930,,,,,,,,,,,4,,N,,J,,1,,,,,,,,,,,,,3
190514,,4,A,"5230046             ",,,Samene - et urfolk i Norden,,2.0,20221,,,J,2022-01-25 13:17:58.642,,,,,,,,,,,4,,N,,J,,16,,,,,,,,,,,,,3
190513,,4,A,"5230051             ",,,Den aktuella svenska samhällsdebatten,,2.0,20221,,,J,2022-01-25 13:19:59.915,,,,,,,,,,,4,,N,,J,,5,,,,,,,,,,,,,3
190511,,113,A,"5230078             ",,,Naturkulturen. Natur in Nordnorwegen und Sápmi,,2.0,20221,,,J,2022-01-25 13:26:09.704,,,,,,,,,,,4,,N,,J,,1,,,,,,,,,,,,,3
190507,,394,A,"5230032             ",,,Die skandinavischen jüngeren Runeninschriften der Wikingerzeit und des Mittelalters als Quellen für Geschichte und Sprachgeschichte,,2.0,20221,,,J,2022-01-25 13:02:37.710,,,,,,,,,,,4,,N,,J,,1,,,,,,,,,,,,,3
190506,,4,A,"5230041             ",,,Wortbildung in der finnischen Sprache - vom Mittelalter bis heute,,2.0,20221,,,J,2022-01-25 13:16:25.432,,,,,,,,,,,4,,N,,J,,1,,,,,,,,,,,,,3
190504,,386,A,"5230086             ",,,Nordeuropa 1977,,2.0,20221,,,J,2022-01-25 13:34:18.919,,,,,,,,,,,4,,N,,J,,1,,,,,,,,,,,,,3
190501,,4,A,"5230011             ",,,Grammatik des Schwedischen,,2.0,20221,,,J,2022-01-25 10:59:06.791,,,,,,,,,,2,4,,N,,J,,1,,,,,,,,,,,,,3
190500,,387,A,"5230021             ",,,Finnisch 4,,4.0,20221,,,J,2022-01-25 12:52:06.910,,,,,,,,,,2,4,,N,,J,,1,,,,,,,,,,,,,3
194299,,113,A,"5210015             ",,,Rainald Goetz &#8211; Geschichten der Gegenwart,,2.0,20221,,,J,2022-02-01 10:45:53.488,,,,,,,,,,1,4,,N,,J,,1,,,,,,,,,,,,,1
192160,,4,A,"5250009             ",,,Oral Skills: Panel Discussions,,2.0,20221,,,J,2022-02-04 11:45:17.596,,,,,,,,,,0,4,,N,,N,,2,,,,,,,,,,,,,3
192157,,4,A,"5250006             ",,,Language Awareness: The Language of Literary Studies,,2.0,20221,,,J,2022-02-04 11:44:31.260,,,,,,,,,,0,4,,N,,N,,2,,,,,,,,,,,,,3
192153,,4,A,"5250002             ",,,Language Awareness: Academic Vocabulary in Use,,2.0,20221,,,J,2022-02-28 10:05:08.844,,,,,,,,,,0,4,,N,,N,,2,,,,,,,,,,,,,3
192163,,4,A,"5250012             ",,,Oral Skills: Literary Literacy in Academic Discussions,,2.0,20221,,,J,2022-02-11 09:31:48.385,,,,,,,,,,0,4,,N,,N,,2,,,,,,,,,,,,,1
193389,,329,A,"532845              ",,,Colloquium für Examenskandidat*innen,,2.0,20221,,,J,2022-02-18 22:24:54.818,,,,,,,,,,0,4,,N,,N,,1,,,,,,,,,,,,,1
194855,,113,A,"532863Ü             ",,,Singing the Nile - Tracing renderings of the Nile from epistemological  reference to lyrical geography,,2.0,20221,,,J,2022-02-28 09:05:23.331,,,,,,,,,,0,4,,J,,J,,2,,,,,,,,,,,,,1
194853,,113,A,"532861Ü             ",,,"Biopolitik, Kulturkritik, Krise. Themen, Autor*innen und Perspektiven der Italian Theory",,2.0,20221,,,J,2022-02-28 09:03:21.749,,,,,,,,,,0,4,,N,,J,,1,,,,,,,,,,,,,1
193366,,332,A,"532881              ",,,Toxic Berlin? - Spurensuche nach den Altlasten einer Region,,2.0,20221,,,J,2022-02-28 21:11:58.307,,,,,,,,,,0,4,,J,,N,,1,,,,,,,,,,,,J,1
192777,,4,A,"5519080             ",,,Sportpsychologie: Übung Individuelle Sport- und Bewegungsbedürfnisse verstehen und analysieren,,2.0,20221,,,J,2022-01-21 12:57:25.512,,,,,,,,,,1,4,,J,,J,,1,,,,,,,,,,,,,3
189919,,359,A,"3314461             ",,,FS Nichtlineare Partielle Differentialgleichungen (Langenbach-Seminar),,2.0,20221,,,J,2022-01-20 09:14:54.897,,,,,,,,,,1,4,,N,,N,,1,,,,,,,,,,,,,1
190411,,113,A,"60310               ",,,Christentums- und Theologiegeschichte der Reformation und Neuzeit - WbSt,,2.0,20221,,,J,2022-03-14 10:03:50.503,,,,,,,,,https://moodle.hu-berlin.de/enrol/index.php?id=111028,,4,,N,,N,,1,,,,,,,,,,,,J,3
192831,,113,A,"53696               ",,,"ACHTSAMKEIT - Gesundheitsförderung und Bewusstseinsbildung; Eine Bewegung zwischen ""westlicher"" Wissenschaft und ""fernöstlicher"" Weisheit",,2.0,20221,,,J,2022-01-10 16:02:23.814,,,,,,,,,,0,4,,N,,J,,1,,,,,,,,,,,,,1
193368,,329,A,"532849              ",,,Bachelor-Kolloquium,,2.0,20221,,,J,2022-02-18 22:28:30.666,,,,,,,,,,0,4,,N,,N,,1,,,,,,,,,,,,,1
193367,,401,A,"532853              ",,,Forschungskolloquium,,1.0,20221,,,J,2022-02-28 21:13:11.874,,,,,,,,,,0,4,,N,,N,,1,,,,,,,,,,,,,1
192155,,4,A,"5250004             ",,,Language Awareness: Humour in British Culture,,2.0,20221,,,J,2022-02-04 11:43:53.246,,,,,,,,,,0,4,,N,,N,,2,,,,,,,,,,,,,3
194300,,113,A,"53536               ",,,"Post- und dekoloniale Ansätze in den Medienwissenschaften, eine Einführung",,2.0,20221,,,J,2022-02-21 17:40:19.283,,,,,,,,,,,4,,J,,J,,1,,,,,,,,,,,,,1
191461,,236,A,"54311               ",,,"Einführung in die Begriffe der Bildung, Erziehung und Schule",,2.0,20221,,,J,2022-02-02 08:52:58.675,,,,,,,,,,2,4,,J,,J,,1,,,,,,,,,,,,J,1
192778,,113,A,"54827               ",,,"Didaktisch-methodische und diagnostische Fragestellungen unter besonderer Berücksichtigung des jeweiligen Förderschwerpunktes, einschließlich Fragen inklusiven Unterrichts",,2.0,20221,,,J,2022-02-24 14:00:13.582,,,,,,,,,,2,4,,N,,J,,1,,,,,,,,,,,,,1
194854,,113,A,"532862Ü             ",,,Zur Dialektik von Geschichte und Struktur. Kritische Theorie und Strukturalismus,,2.0,20221,,,J,2022-02-28 09:04:19.664,,,,,,,,,,0,4,,N,,J,,1,,,,,,,,,,,,,1
194862,,113,A,"532870Ü             ",,,Ästhetik: Theoretische Texte vom 18. bis ins 21. Jahrhundert,,2.0,20221,,,J,2022-02-28 09:17:40.397,,,,,,,,,,0,4,,N,,J,,1,,,,,,,,,,,,,1
192806,,359,A,"51495               ",,,"Revolutionen machen. Konzepte, Praxen, Traditionen von &#8222;Revolution&#8220; seit der Frühen Neuzeit",,2.0,20221,,,J,2022-02-23 15:48:02.568,,,,,,,,,,0,4,,N,,J,,1,,,,,,,,,,,,,1
192817,,113,A,"51550               ",,,Einführung in die Geschichte/LA an Grundschulen,,2.0,20221,,,J,2022-01-31 18:22:22.803,,,,,,,,,,1,4,,J,,J,,1,,,,,,,,,,,,,4
193897,,113,A,"5230083             ",,,Die skandinavischen jüngeren Runeninschriften der Wikingerzeit und des Mittelalters als Quellen für Geschichte und Sprachgeschichte,,2.0,20221,,,J,2022-01-25 13:29:28.825,,,,,,,,,,,4,,N,,J,,1,,,,,,,,,,,,,3
192172,,4,A,"5250021             ",,,Written Academic Discourse: Writing Academic Essays,,2.0,20221,,,J,2022-02-11 09:32:21.411,,,,,,,,,,0,4,,N,,N,,2,,,,,,,,,,,,,1
192156,,4,A,"5250005             ",,,Language Awareness: Academic Writing and Critical Thinking,,2.0,20221,,,J,2022-03-16 10:58:38.138,,,,,,,,,,0,4,,N,,N,,2,,,,,,,,,,,,,3
192779,,113,A,"54828               ",,,Vorbereitung des Praxissemesters im FSP Sprache,,2.0,20221,,,J,2022-02-24 14:00:13.589,,,,,,,,,,2,4,,N,,J,,1,,,,,,,,,,,,,1
192158,,4,A,"5250007             ",,,Language Awareness: The Language of Cultural Studies,,2.0,20221,,,J,2022-02-04 11:44:47.310,,,,,,,,,,0,4,,N,,N,,2,,,,,,,,,,,,,3
192169,,4,A,"5250018             ",,,Oral Skills: Presentation Practice,,2.0,20221,,,J,2021-12-09 17:47:31.157,,,,,,,,,,0,4,,N,,N,,2,,,,,,,,,,,,,1
192164,,4,A,"5250013             ",,,Oral Skills: Debates and Discussions,,2.0,20221,,,J,2022-02-04 11:46:24.233,,,,,,,,,,0,4,,N,,N,,2,,,,,,,,,,,,,3
192780,,113,A,"54840               ",,,Nachbereitung des Berufsfelderschließenden Praktikums im FSP Sprache,,2.0,20221,,,J,2022-02-24 13:59:33.878,,,,,,,,,,2,4,,N,,J,,1,,,,,,,,,,,,,1
193387,,326,A,"51063               ",,,Einführung in die Fachdidaktik Philosophie/Ethik I,,2.0,20221,,,J,2022-02-26 21:31:06.826,,,,,,,,,,0,4,,N,,N,,1,,,,,,,,,,,,J,1
193313,,236,A,"532813              ",,,Träumen in Zeiten der Schlaflosigkeit,,2.0,20221,,,J,2022-02-28 23:47:52.304,,,,,,,,,,0,4,,N,,N,,1,,,,,,,,,,,,J,1
193369,,401,A,"532852              ",,,Examenskolloquium,,1.0,20221,,,J,2022-02-18 22:30:31.816,,,,,,,,,,0,4,,N,,N,,1,,,,,,,,,,,,,1
194856,,113,A,"532864Ü             ",,,The New European Bauhaus: Zur Genealogie und Kritik eines designpolitischen Projekts,,2.0,20221,,,J,2022-02-28 09:07:53.611,,,,,,,,,,0,4,,J,,J,,1,,,,,,,,,,,,,2
194861,,113,A,"532869Ü             ",,,Sadismus mit und ohne Sade,,2.0,20221,,,J,2022-02-28 09:16:49.579,,,,,,,,,,0,4,,N,,J,,1,,,,,,,,,,,,,1
193898,,421,A,"2739680             ",,,"""Team- und Führungskräftetraining für den Berufseinstieg""",,3.0,20221,,,J,2022-01-20 10:17:12.847,,,,,,,,,,1,4,,J,,N,,1,,,,,,,,,,,,,4
194302,,113,A,"5270160             ",,,Unterweltsgang und Divination: Eine (inter)kulturelle Erkundung des 6. Buchs der Aeneis,,2.0,20221,,,J,2022-02-01 11:18:34.436,,,,,,,,,,2,4,,J,,J,,1,,,,,,,,,,,,,1
192159,,4,A,"5250008             ",,,Language Awareness: The Language of Linguistics,,2.0,20221,,,J,2022-02-04 11:45:04.660,,,,,,,,,,0,4,,N,,N,,2,,,,,,,,,,,,,3
192168,,4,A,"5250017             ",,,Oral Skills: Part of the Panel,,2.0,20221,,,J,2022-02-17 14:11:38.230,,,,,,,,,,0,4,,N,,J,,2,,,,,,,,,,,,,1
192781,,113,A,"54835               ",,,Linguistische Grundlagen im Förderschwerpunkt Sprache,,2.0,20221,,,J,2022-02-24 13:59:33.862,,,,,,,,,,2,4,,N,,J,,1,,,,,,,,,,,,,1
194857,,113,A,"532865Ü             ",,,Material Legacies. On the Geo-Bio-Politics of Material Transformation,,2.0,20221,,,J,2022-02-28 09:20:03.295,,,,,,,,,,0,4,,N,,J,,2,,,,,,,,,,,,,4
191462,,113,A,"7010922             ",,,Economic History of the Middle East: A Long-Term Perspective,,2.0,20221,,,J,2021-11-30 13:44:41.372,,,,,,,,,,,4,,N,,N,,2,,,,,,,,,,,,,1
193906,,113,A,TU831               ,,,"From plague to covid. Gender, social space and disease.",,3.0,20221,,,J,2022-01-21 16:59:25.477,,,,,,,,,,0,4,,N,,N,,9,,,,,,,,,,,,J,4
193899,,113,A,TU950               ,,,Werkzeugkiste: Empirische Methoden in den Gender Studies,,2.0,20221,,,J,2022-01-29 09:07:06.963,,,,,,,,,,0,4,,N,,N,,1,,,,,,,,,,,,J,4
190419,,4,A,"60314               ",,,Frauen in kirchlichen Ämtern. Streifzüge durch 2000 Jahre Christentumsgeschichte (Die Übung entfällt!),,2.0,20221,,,J,2022-03-10 14:32:34.889,,,,,,,,,,,4,,J,,N,,1,,,,,,,,,,,,J,1
194301,,113,A,"5270160Ü            ",,,Unterweltsgang und Divination: Eine (inter)kulturelle Erkundung des 6. Buchs der Aeneis,,2.0,20221,,,J,2022-02-01 11:22:35.211,,,,,,,,,,1,4,,J,,J,,1,,,,,,,,,,,,,1
193371,,401,A,"9610092             ",,,Reflexion,,2.0,20221,,,J,2022-02-01 15:38:46.246,,,,,,,,,https://moodle.hu-berlin.de/course/view.php?id=110479,2,4,,N,,J,,1,,,,,,,,,,,,,1
194858,,113,A,"532866Ü             ",,,Doctor/patient relationships in Europe (1750-1850),,2.0,20221,,,J,2022-02-28 09:10:31.670,,,,,,,,,,0,4,,N,,J,,2,,,,,,,,,,,,,1
192161,,4,A,"5250010             ",,,Oral Skills: Exploring Culture and Society in the USA,,2.0,20221,,,J,2022-02-11 09:31:14.431,,,,,,,,,,0,4,,N,,N,,2,,,,,,,,,,,,,1
193388,,326,A,"51064               ",,,Einführung in die Fachdidaktik Philosophie/Ethik II,,2.0,20221,,,J,2022-02-26 21:31:58.731,,,,,,,,,,0,4,,N,,N,,1,,,,,,,,,,,,J,1
193372,,332,A,"532839              ",,,Die Kultur des Traumas: Geschichte - Ästhetik - Aktualität,,2.0,20221,,,J,2022-02-28 20:57:45.484,,,,,,,,,,0,4,,N,,N,,1,,,,,,,,,,,,J,1
191464,,412,A,"54308               ",,,Bildungsgeschichtliche und kulturwissenschaftliche Forschungen der Gegenwart,,2.0,20221,,,J,2022-02-02 08:50:55.637,,,,,,,,,,1,4,,J,,J,,9,,,,,,,,,,,,J,4
193379,,113,A,"532830              ",,,Kunstkammern,,2.0,20221,,,J,2022-02-28 20:49:28.145,,,,,,,,,,0,4,,N,,N,,1,,,,,,,,,,,,J,2
194859,,113,A,"532867Ü             ",,,Verwundbare Körper des Politischen. Vulnerability revisited (Begleit-SE zur RVL),,2.0,20221,,,J,2022-03-04 18:29:16.649,,,,,,,,,,0,4,,J,,J,,1,,,,,,,,,,,,,2
194863,,113,A,"532871Ü             ",,,Der Baum am Ende der Welt. Kultur- und wissensgeschichtliche Perspektiven auf Wälder und Holz im Schwarzen Anthropozän,,2.0,20221,,,J,2022-02-28 09:18:48.639,,,,,,,,,,0,4,,J,,J,,1,,,,,,,,,,,,,1
193900,,113,A,TU920               ,,,Transdisziplinäre Geschlechterstudien zu Wissenschaft und Technik - Einführung,,2.0,20221,,,J,2022-01-29 09:02:15.702,,,,,,,,,,0,4,,N,,N,,1,,,,,,,,,,,,J,4
190420,,341,A,"60318               ",,,Neuere Forschungen zur Christentumsgeschichte,,1.0,20221,,,J,2022-01-24 22:03:09.740,,,,,,,,,,,4,,N,,N,,1,,,,,,,,,,,,J,4
194264,,113,A,"10744               ",,,"Die Finanz-, Fiskal- und Währungsverfassung der EU nach dem Europäischen Aufbauplan",,2.0,20221,,,J,2022-01-31 17:42:50.460,,,,,,,,,https://moodle.hu-berlin.de/course/view.php?id=110465,,4,,N,,N,,1,,,,,,,,,,,,,1
189817,,4,A,"5270001Ü            ",,,Einführung in die griechische Kultur und Landeskunde,,2.0,20221,,,J,2021-10-01 13:12:44.761,,,,,,,,,,2,4,,J,,J,,1,,,,,,,,,,,,,1
191886,,401,A,"53681               ",,,Abschlusskolloquium Japan,,2.0,20221,,,,2022-01-10 15:21:43.499,,,,,,,,,,,4,,,,J,,1,,,,,,,,,,,,J,3
189815,,325,A,"5270003Ü            ",,,Einführung in das griechische Epos,,2.0,20221,,,J,2022-01-04 16:24:21.710,,,,,,,,,,2,4,,J,,J,,1,,,,,,,,,,,,,1
191466,,338,A,"5519042             ",,,Organisation(en) im Sport,,2.0,20221,,,J,2022-01-25 16:11:15.906,,,,,,,,,,,4,,J,,J,,1,,,,,,,,,,,,,1
190422,,335,A,"60211               ",,,Repetitorium Neues Testament (791 [SO 2017]),,2.0,20221,,,J,2022-02-23 14:33:03.482,,,,,,,,,,2,4,,N,,N,,1,,,,,,,,,,,,J,1
192820,,342,A,"51610               ",,,Exkursionen,,2.0,20221,,,J,2022-01-31 18:28:34.664,,,,,,,,,,0,4,,N,,J,,1,,,,,,,,,,,,,1
191487,,4,A,"5250049             ",,,Topics in Diachronic Linguistics,,2.0,20221,,,J,2021-11-30 14:18:43.837,,,,,,,,,,0,4,,N,,J,,2,,,,,,,,,,,,,1
192175,,4,A,"5250024             ",,,Writing the Term Paper,,2.0,20221,,,J,2022-02-11 09:32:53.456,,,,,,,,,,0,4,,N,,N,,2,,,,,,,,,,,,,1
191517,,113,A,"5250063             ",,,Psycholinguistics,,2.0,20221,,,J,2021-11-30 15:26:20.982,,,,,,,,,,0,4,,N,,J,,2,,,,,,,,,,,,,1
194860,,113,A,"532868Ü             ",,,Der Leib als Aneigner:in  von Kultur und Wissen,,2.0,20221,,,J,2022-02-28 09:14:56.494,,,,,,,,,,0,4,,N,,J,,1,,,,,,,,,,,,,1
190423,,236,A,"60200               ",,,"Römerbrief (GS/HS - H 120/121/122/123/220/420/421/620, BA[V]NTmG, MEd B-mG, MRC-B1,V1f, BM1,VM1a-mG)",,4.0,20221,,,J,2022-02-15 15:05:13.929,,,,,,,,,,,4,,N,,N,,1,,,,,,,,,,,,J,1
189814,,325,A,"5270002Ü            ",,,Einführung in das griechische Drama,,2.0,20221,,,J,2021-10-01 13:12:41.624,,,,,,,,,,2,4,,J,,J,,1,,,,,,,,,,,,,1
192170,,4,A,"5250019             ",,,Oral Skills: Speaking of Education,,2.0,20221,,,J,2022-02-11 09:32:05.300,,,,,,,,,,0,4,,N,,N,,2,,,,,,,,,,,,,1
191486,,4,A,"5250048i            ",,,Old English,,2.0,20221,,,J,2021-11-30 14:17:10.719,,,,,,,,,,0,4,,N,,J,,2,,,,,,,,,,,,,1
194484,,113,A,"5250122             ",,,Englischunterricht in multilingualen Lerngruppen,,2.0,20221,,,J,2022-02-28 09:41:34.440,,,,,,,,,,0,4,,N,,J,,2,,,,,,,,,,,,J,2
192790,,421,A,"3312159Ü            ",,,Kartographie und Geomedien (ÜWP),,2.0,20221,,,J,2022-01-24 11:39:53.759,,,,,,,,,https://moodle.hu-berlin.de/course/view.php?id=93059,2,4,,N,,J,,1,,,,,,,,,,,,,1
193901,,113,A,TU921               ,,,Transdisziplinäre Geschlechterstudien zu Wissenschaft und Technik - Einführung,,2.0,20221,,,J,2022-01-29 09:02:54.830,,,,,,,,,,0,4,,N,,N,,1,,,,,,,,,,,,J,2
190424,,113,A,"60203               ",,,"Ende mit Schrecken oder Schrecken ohne Ende? Die Apokalyptik in Geschichte und Gegenwart und ihre Bedeutung für eine theologische und politische Wahrnehmung von Zeit und Welt (HS - H420/421/621/622,440/441/643, BA[V]NTmG, MRC-V1f,B3a,V3a,VM1a,BM3,VM4b-mG)",,2.0,20221,,,J,2022-01-24 11:31:37.216,,,,,,,,,,,4,,N,,N,,1,,,,,,,,,,,,J,1
189866,,325,A,"5270024             ",,,"Ovid, Amores",,2.0,20221,,,J,2021-10-01 13:13:41.923,,,,,,,,,,2,4,,J,,J,,1,,,,,,,,,,,,,1
193916,,113,A,"9610109             ",,,Koranwissenschaften und Koranexegese,,2.0,20221,,,J,2022-02-07 07:41:00.267,,,,,,,,,https://moodle.hu-berlin.de/course/view.php?id=110417,2,4,,N,,J,,1,,,,,,,,,,,,,1
192171,,4,A,"5250020             ",,,Written Academic Discourse: Academic Essays,,2.0,20221,,,J,2022-01-28 09:02:18.311,,,,,,,,,,0,4,,N,,N,,2,,,,,,,,,,,,,3
192791,,113,A,"54825               ",,,Förderdiagnostik im Förderschwerpunkt Sprache,,2.0,20221,,,J,2022-02-24 14:00:13.567,,,,,,,,,,1,4,,N,,J,,1,,,,,,,,,,,,,1
189855,,374,A,"5270042             ",,,Sprachkurs Griechisch - Vorbereitung auf das Graecum II,,8.0,20221,,,J,2021-10-01 13:13:29.604,,,,,,,,,,2,4,,J,,J,,1,,,,,,,,,,,,,1
191469,,338,A,"5519041             ",,,Sport und Bewegung in informellen Kontexten/ selbstorganisierter Sport,,2.0,20221,,,J,2022-01-07 15:41:56.921,,,,,,,,,,,4,,N,,J,,1,,,,,,,,,,,,,1
190426,,401,A,"60209               ",,,Kolloquium,,2.0,20221,,,J,2022-02-15 15:05:44.571,,,,,,,,,,1,4,,N,,N,,1,,,,,,,,,,,,J,1
194864,,113,A,Ü51702              ,,,Migration Matters,,2.0,20221,,,J,2022-02-28 11:22:18.556,,,,,,,,,,0,4,,N,,J,,1,,,,,,,,,,,,,1
194865,,332,A,"0212015             ",,,Nature as Remedy? Exploring how Berliners care for a healthier city,,2.0,20221,,,J,2022-02-28 13:58:41.972,,,,,,,,,,0,4,,J,,N,,2,,,,,,,,,,,,,4
194866,,113,A,Ü51704              ,,,Museum Matters,,2.0,20221,,,J,2022-02-28 11:28:21.707,,,,,,,,,,0,4,,N,,J,,1,,,,,,,,,,,,,1
