"veranstid","verart","verartid","aikz","veranstnr","veranstnrint","ktxt","dtxt","ltxt","sws","semester","erwartteilnehmer","teilnehmermax","druck_vvz","zeitstempel","lehrmethoden","voraussetzung","verweise","pruefungsstoff","credits","kommentar","bemerkung","literatur","hyperlink","uebernrhythm","veranststatusid","pruefmoegl","freigabe","publish","belegpflicht","geschl","unterrsprache","praesenzzeit","art_praesenzzeit","ssz","studienjahr","kosten","externperson","externinst","evalartid","externid","fachuebergreifend_kz","curricular_kz","sichtbar","verformatid"
194316,,236,A,,,,"""Team- und Führung""",,3.0,20221,,,J,2022-02-02 12:11:17.180,,,,,,,,,,1,4,,N,,N,,1,,,,,,,,,,,,J,4
194317,,236,A,,,,"""Team- und Führung""",,3.0,20221,,,J,2022-02-02 12:13:05.669,,,,,,,,,,1,4,,N,,N,,1,,,,,,,,,,,,J,4
193846,,353,A,"10765               ",,,Mechanisms for the Enforcement of International Criminal Law,,2.0,20221,,,J,2022-02-02 12:28:34.643,,,,,,,,,https://moodle.hu-berlin.de/course/view.php?id=110502,,4,,N,,N,,2,,,,,,,,,,,,,3
194328,,113,A,"5240431Ü            ",,,Inklusion und Heterogenität im Spanischunterricht,,2.0,20221,,,J,2022-02-02 14:02:01.615,,,,,,,,,,0,4,,N,,J,,1,,,,,,,,,,,,,1
194327,,113,A,"5240430Ü            ",,,Problemfelder des Fremdsprachenlehrens und &#8211;lernens: Mehrsprachigkeit und Mehrkulturalität im Fremdsprachenunterricht,,2.0,20221,,,J,2022-02-02 14:00:40.860,,,,,,,,,,0,4,,N,,J,,1,,,,,,,,,,,,,1
194324,,113,A,"5240422Ü            ",,,Perspektiven fremdsprachendidaktischer Forschung: Dramen- und Dramapädagogik,,2.0,20221,,,J,2022-02-02 13:57:37.926,,,,,,,,,,0,4,,N,,J,,1,,,,,,,,,,,,,1
194322,,113,A,"5240426Ü            ",,,Perspektiven fremdsprachendididaktischer Forschung: Bilingualer Unterricht,,2.0,20221,,,J,2022-02-02 13:54:46.292,,,,,,,,,,0,4,,N,,J,,1,,,,,,,,,,,,,1
194321,,113,A,"5240421Ü            ",,,Perspektiven fremdsprachendidaktischer Forschung: Städte,,2.0,20221,,,J,2022-02-02 13:53:22.805,,,,,,,,,,0,4,,N,,J,,1,,,,,,,,,,,,,1
194320,,113,A,"5240425Ü            ",,,Inklusion und Heterogenität im Französisch- und Italienischunterricht,,2.0,20221,,,J,2022-02-02 13:51:38.730,,,,,,,,,,0,4,,N,,J,,1,,,,,,,,,,,,,1
192104,,329,A,"10907               ",,,"FRS Russisch: Schuldrecht BT, Gesetzliche Schuldverhältnisse, IPR und Recht des geistigen Eigentums (Modul 4)",,4.0,20221,,,J,2022-02-02 16:30:12.287,,,,,,,,,https://moodle.hu-berlin.de/course/view.php?id=110200,2,4,,N,,J,,7,,,,,,,,,,,,,1
194332,,421,A,"2739663             ",,,"""Öffentlich sprechen  - für potenzielle Berufsredner_innen""",,3.0,20221,,,J,2022-02-03 11:32:58.272,,,,,,,,,,1,4,,J,,N,,1,,,,,,,,,,,,,4
194333,,113,A,"53842               ",,,Sexualisierte Gewalt &#8211; Chancen und Herausforderungen außer/gerichtlicher Aufarbeitungsprozesse,,2.0,20221,,,J,2022-02-03 12:36:27.489,,,,,,,,,,0,4,,N,,J,,1,,,,,,,,,,,,J,1
192785,,419,A,"3312100             ",,,Resonante Räume,,4.0,20221,,,J,2022-02-03 14:39:39.390,,,,,,,,,,0,4,,N,,J,,1,,,,,,,,,,,,,1
191101,,361,A,"20176               ",,,Advanced Environmental and Resource Economics: Environmental Institutions and Governance,,4.0,20221,,,J,2022-02-03 14:56:29.729,,,,,,,,,https://moodle.hu-berlin.de/course/view.php?id=110105,2,4,,N,,N,,2,,,,,,,,,,,,,3
194335,,236,A,"5220040Ü            ",,,Morphologie,,2.0,20221,,,J,2022-02-04 10:51:00.984,,,,,,,,,,0,4,,N,,J,,1,,,,,,,,,,,,,1
194336,,236,A,"5220043Ü            ",,,Syntax,,2.0,20221,,,J,2022-02-04 10:58:29.974,,,,,,,,,,0,4,,N,,J,,1,,,,,,,,,,,,,1
194337,,236,A,"5220009Ü            ",,,Ebenen der Textanalyse,,2.0,20221,,,J,2022-02-04 11:01:53.803,,,,,,,,,,0,4,,N,,J,,1,,,,,,,,,,,,,1
194341,,113,A,"5220028Ü            ",,,Semantik,,2.0,20221,,,J,2022-02-04 12:58:42.838,,,,,,,,,,1,4,,N,,J,,1,,,,,,,,,,,,,1
194342,,113,A,"5220029Ü            ",,,Syntax,,2.0,20221,,,J,2022-02-04 13:07:31.521,,,,,,,,,,1,4,,N,,J,,1,,,,,,,,,,,,,1
194343,,4,A,"5220030Ü            ",,,Einführung in die Statistik,,4.0,20221,,,J,2022-02-04 13:11:11.664,,,,,,,,,,1,4,,N,,J,,1,,,,,,,,,,,,,1
194344,,113,A,"5220051Ü            ",,,Situational language processing in the brain,,2.0,20221,,,J,2022-02-04 13:17:35.476,,,,,,,,,,0,4,,N,,J,,2,,,,,,,,,,,,,1
194348,,113,A,"5220083Ü            ",,,Altenglisch,,2.0,20221,,,J,2022-02-04 13:39:36.377,,,,,,,,,,0,4,,N,,J,,1,,,,,,,,,,,,,1
194351,,332,A,"3313098             ",,,Simulation Peer Review,,1.0,20221,,,J,2022-02-25 08:15:10.977,,,,,,,,,,,4,,N,,J,,1,,,,,,,,,,,,,1
194352,,236,A,"2112013             ",,,Mikrobiologie für Halbmodul Bio9/Bioph13 H,,3.0,20221,,,J,2022-02-08 17:58:34.341,,,,,,,,,,2,4,,J,,J,,1,,,,,,,,,,,,,3
194356,,434,A,"5519048             ",,,DMS3_Bewegungsformen und Spiele erweitern und vertiefen,,2.0,20221,,,J,2022-02-04 18:00:40.885,,,,,,,,,,1,4,,J,,J,,1,,,,,,,,,,,,,1
193699,,4,A,"5240360Ü            ",,,Mündlicher Ausdruck und Hörverstehen A2,,4.0,20221,,,J,2022-01-14 11:53:31.544,,,,,,,,,,0,4,,N,,J,,24,,,,,,,,,,,,,1
191446,,113,A,"54149               ",,,"Modul 6a (Bachelor; SU): Konzeptionen und Theorien des Sachunterrichts und seiner Didaktik - Vertiefung Didaktik Sachunterricht | SE Erkenntnis-, Bildungs- und Lerntheorien im Kontext der Sachunterrichtsdidaktik",,2.0,20221,,,J,2022-02-05 08:06:11.996,,,,,,,,,,1,4,,N,,J,,1,,,,,,,,,,,,,2
194340,,236,A,"5220011Ü            ",,,Zweitspracherwerb und Mehrsprachigkeit,,2.0,20221,,,J,2022-02-04 11:10:22.175,,,,,,,,,,0,4,,N,,J,,1,,,,,,,,,,,,,1
194350,,113,A,"5220097Ü            ",,,Altpreußisch,,2.0,20221,,,J,2022-02-04 13:45:24.591,,,,,,,,,,0,4,,N,,J,,1,,,,,,,,,,,,,1
193700,,4,A,"5240363Ü            ",,,Textlektüre A2/B1,,2.0,20221,,,J,2022-01-14 11:54:44.103,,,,,,,,,,0,4,,N,,J,,24,,,,,,,,,,,,,1
194345,,113,A,"5220052Ü            ",,,Der Fragebogen als Erhebungsinstrument der Linguistik,,2.0,20221,,,J,2022-02-04 14:55:35.902,,,,,,,,,,0,4,,N,,J,,1,,,,,,,,,,,,,1
194349,,113,A,"5220086Ü            ",,,Jungavestisch,,2.0,20221,,,J,2022-02-04 13:42:41.965,,,,,,,,,,0,4,,N,,J,,1,,,,,,,,,,,,,1
193704,,4,A,"53459               ",,,Harmonielehre (Kurs I),,2.0,20221,,,J,2022-01-19 14:59:36.772,,,,,,,,,,1,4,,N,,N,,1,,,,,,,,,,,,J,1
193705,,4,A,"53460               ",,,Harmonielehre (Kurs II),,2.0,20221,,,J,2022-01-19 15:01:35.480,,,,,,,,,,1,4,,N,,N,,1,,,,,,,,,,,,J,1
193706,,4,A,"53457               ",,,Gehörbildung (Basiskurs),,1.0,20221,,,J,2022-02-11 20:23:49.844,,,,,,,,,,1,4,,N,,N,,1,,,,,,,,,,,,J,1
194358,,113,A,"53920               ",,,"Gender, Environment and Sustainability: Theory and Debates",,2.0,20221,,,J,2022-02-06 21:42:41.725,,,,,,,,,,0,4,,N,,J,,2,,,,,,,,,,,,J,3
194361,,429,A,"21811699            ",,,Intelligente Roboter: Welche sozialen Fähigkeiten lassen Roboter intelligent erscheinen?,,2.0,20221,,,J,2022-02-07 08:46:21.325,,,,,,,,,,0,4,,J,,J,,2,,,,,,,,,,,,J,2
194362,,4,A,"51473               ",,,Wer hat es geschrieben? Authorship Attribution als Methode der Digital History,,2.0,20221,,,J,2022-02-07 09:03:25.936,,,,,,,,,,0,4,,N,,J,,1,,,,,,,,,,,,,1
194363,,342,A,"20437               ",,,Topics in Agricultural and Food Policy,,4.0,20221,,,J,2022-02-07 10:11:33.579,,,,,,,,,https://moodle.hu-berlin.de/course/view.php?id=109997,0,4,,N,,N,,2,,,,,,,,,,,,,1
194318,,236,A,"10632               ",,,Gestaltungsthemen im Religionsverfassungsrecht im nationalen wie europäischen Kontext,,2.0,20221,,,J,2022-02-07 11:30:17.366,,,,,,,,,https://moodle.hu-berlin.de/course/view.php?id=110519,,4,,N,,N,,1,,,,,,,,,,,,,1
194365,,429,A,"21811700            ",,,Life Writing as a Democratizing Practice: Hybrid Feminist and Queer Writing 1960-1990,,2.0,20221,,,J,2022-02-07 12:12:03.852,,,,,,,,,,0,4,,J,,J,,2,,,,,,,,,,,,J,2
194366,,236,A,"54761Ü              ",,,Grundlagen lebenslanger Entwicklung,,2.0,20221,,,J,2022-02-24 14:01:35.926,,,,,,,,,,1,4,,J,,J,,1,,,,,,,,,,,,,1
194369,,113,A,"54812Ü              ",,,Erleben chronischer Krankheit und Behinderung,,2.0,20221,,,J,2022-02-24 14:00:13.528,,,,,,,,,,0,4,,N,,J,,1,,,,,,,,,,,,,1
194377,,113,A,"54816Ü              ",,,Der partizipative Forschungsstil,,2.0,20221,,,J,2022-02-24 14:00:13.558,,,,,,,,,,0,4,,N,,J,,1,,,,,,,,,,,,,1
194379,,433,A,"54789Ü              ",,,Kommunikationstheoretische Grundlagen der UK,,2.0,20221,,,J,2022-02-24 14:00:57.108,,,,,,,,,,2,4,,N,,J,,1,,,,,,,,,,,,,1
194381,,113,A,"54665Ü              ",,,Kommunikationsformen und -systeme für Menschen mit vers. Beeinträchtigungen,,2.0,20221,,,J,2022-02-24 13:45:02.443,,,,,,,,,,,4,,N,,J,,1,,,,,,,,,,,,,1
194455,,113,A,"53759               ",,,Sprachliche und kulturelle Identitäten von Überseechinesen,,2.0,20221,,,,2022-02-15 12:18:34.148,,,,,,,,,,2,4,,,,J,,1,,,,,,,,,,,,J,3
194382,,113,A,"54741Ü              ",,,Pädagogische Begleitung von Kindern und Jugendlichen mit progredienten Erkrankungen; Didaktisch-methodische Fragestellungen,,2.0,20221,,,J,2022-02-24 14:02:29.424,,,,,,,,,,1,4,,N,,J,,1,,,,,,,,,,,,,1
194383,,113,A,"54733Ü              ",,,Spezifische Aspekte der Pädagogik für Kinder und Jugendliche mit lvE,,2.0,20221,,,J,2022-02-24 14:02:29.388,,,,,,,,,,2,4,,N,,J,,1,,,,,,,,,,,,,1
194385,,113,A,"54716Ü              ",,,Spezielle Aspekte der Pädagogik für Kinder und Jugendliche mit komplexer Behinderung,,2.0,20221,,,J,2022-02-24 14:00:48.941,,,,,,,,,,0,4,,N,,J,,1,,,,,,,,,,,,,1
194387,,113,A,"54674Ü              ",,,"Laut-, Schrift- und Gebärdenspracherwerb",,2.0,20221,,,J,2022-02-24 13:46:55.893,,,,,,,,,,,4,,N,,J,,1,,,,,,,,,,,,,1
194388,,113,A,"54873Ü              ",,,Außerschulische Bildung: Inklusive Angebote für Lernende mit multiplen Teilhabebarrieren entwickeln,,2.0,20221,,,J,2022-02-24 13:57:55.902,,,,,,,,,,0,4,,N,,J,,1,,,,,,,,,,,,,1
194395,,236,A,"2112024a            ",,,Theoretische Biophysik,,2.0,20221,,,J,2022-02-07 19:44:20.398,,,,,,,,,https://moodle.hu-berlin.de/course/view.php?id=110092,2,4,,J,,N,,1,,,,,,,,,,,,,1
194397,,4,A,"2112025a            ",,,Theoretische Physik und Biophysik,,2.0,20221,,,J,2022-02-07 19:44:03.682,,,,,,,,,https://moodle.hu-berlin.de/course/view.php?id=110092,2,4,,J,,J,,1,,,,,,,,,,,,,1
194396,,236,A,"2112026a            ",,,Theoretische Physik,,2.0,20221,,,J,2022-02-07 19:44:12.118,,,,,,,,,https://moodle.hu-berlin.de/course/view.php?id=110092,2,4,,J,,N,,1,,,,,,,,,,,,,1
194399,,429,A,"21811701            ",,,Security Governance and Democracy,,2.0,20221,,,J,2022-02-08 10:16:33.352,,,,,,,,,,0,4,,J,,J,,2,,,,,,,,,,,,J,2
194405,,4,A,"2112014a            ",,,Mikrobiologische Übungen,,4.0,20221,,,J,2022-02-08 15:33:03.954,,,,,,,,,,2,4,,J,,N,,1,,,,,,,,,,,,,1
194398,,113,A,"530070              ",,,Stability and Change: Eastern Europe in Comparative Perspective,,2.0,20221,,,J,2022-03-01 10:14:44.317,,,,,,,,,,0,4,,J,,J,,2,,,,,,,,,,,,J,2
194407,,236,A,"53757               ",,,Einführungsvorlesung Kultur/Identität,,2.0,20221,,,J,2022-02-09 14:31:14.668,,,,,,,,,,2,4,,J,,J,,1,,,,,,,,,,,,,1
194406,,113,A,"10613               ",,,Verfassungsrecht und Politik,,2.0,20221,,,J,2022-02-08 16:48:47.895,,,,,,,,,https://moodle.hu-berlin.de/course/view.php?id=110571,,4,,N,,N,,1,,,,,,,,,,,,J,1
194408,,236,A,"51008               ",,,Probleme einer Philosophischen Gotteslehre,,2.0,20221,,,J,2022-02-26 19:46:01.914,,,,,,,,,,0,4,,N,,N,,1,,,,,,,,,,,,J,1
192167,,4,A,"5250016             ",,,Oral Skills: Social Media/Social Justice Movements in the US: #MeToo and #BLM,,2.0,20221,,,J,2022-02-04 11:47:18.248,,,,,,,,,,0,4,,N,,N,,2,,,,,,,,,,,,,3
191892,,113,A,"5250092             ",,,Culture and Context: Topics in American History,,2.0,20221,,,J,2021-12-07 12:05:19.545,,,,,,,,,,0,4,,N,,J,,2,,,,,,,,,,,,,1
191891,,4,A,"5250091i            ",,,Lektüreübung,,1.0,20221,,,J,2021-12-07 12:03:59.791,,,,,,,,,,0,4,,N,,J,,2,,,,,,,,,,,,,1
191889,,4,A,"5250091             ",,,Lektüreübung,,1.0,20221,,,J,2021-12-07 11:57:36.510,,,,,,,,,,0,4,,N,,J,,2,,,,,,,,,,,,,1
194409,,113,A,"10521               ",,,lege artis - Handwerk und Kunst der juristischen Falllösungsmethode,,2.0,20221,,,J,2022-02-10 15:45:24.949,,,,,,,,,https://moodle.hu-berlin.de/course/view.php?id=110591,,4,,N,,N,,1,,,,,,,,,,,,,2
194420,,236,A,CUB2738             ,,,Einführung in die Sexualwissenschaft/Sexualmedizin,,2.0,20221,,,J,2022-02-10 13:48:19.962,,,,,,,,,,1,4,,J,,N,,1,,,,,,,,,,,,,2
194393,,113,A,"2112QMB009SE        ",,,Current topics in epigenetics,,2.0,20221,,,J,2022-02-10 18:04:29.994,,,,,,,,,https://moodle.hu-berlin.de/course/view.php?id=110071,2,4,,N,,N,,2,,,,,,,,,,,,J,1
194394,,375,A,"2112QMB009PR        ",,,Methods in epigenetics,,8.0,20221,,,J,2022-02-10 18:05:04.697,,,,,,,,,https://moodle.hu-berlin.de/course/view.php?id=110071,2,4,,N,,J,,2,,,,,,,,,,,,J,1
194392,,236,A,"2112QMB009L         ",,,Chromatin and Epigenetics,,2.0,20221,,,J,2022-02-10 18:05:12.471,,,,,,,,,https://moodle.hu-berlin.de/course/view.php?id=110071,2,4,,N,,N,,2,,,,,,,,,,,,J,1
192162,,4,A,"5250011             ",,,Oral Skills: Considering People and Politics in the USA,,2.0,20221,,,J,2022-02-11 09:31:32.275,,,,,,,,,,0,4,,N,,N,,2,,,,,,,,,,,,,1
194422,,429,A,"21811703            ",,,Research project development in theory and practice with application to a real-world data set on Syrian refugees in Europe and Middle East,,2.0,20221,,,J,2022-02-11 09:45:00.558,,,,,,,,,,0,4,,J,,J,,2,,,,,,,,,,,,J,2
194426,,113,A,"530195              ",,,Demokratietheorie (ÜWP),,2.0,20221,,,J,2022-02-16 10:55:54.981,,,,,,,,,,0,4,,N,,J,,1,,,,,,,,,,,,,1
194427,,113,A,"530196              ",,,Asylpolitik und Asylrecht: Methoden und Theorien der Fluchtforschung zwischen Sozial- und Rechtswissenschaften (ÜWP),,2.0,20221,,,J,2022-02-24 09:43:44.953,,,,,,,,,,0,4,,N,,J,,1,,,,,,,,,,,,,1
194428,,113,A,"530165              ",,,Arbeit und Migration aus wohlfahrtsstaatlicher Perspektive (ÜWP),,2.0,20221,,,J,2022-02-16 10:51:14.230,,,,,,,,,,0,4,,N,,J,,1,,,,,,,,,,,,,1
194433,,113,A,"530207              ",,,Einführung in die Politische Soziologie (ÜWP),,2.0,20221,,,J,2022-02-16 10:58:21.186,,,,,,,,,,0,4,,N,,J,,1,,,,,,,,,,,,,1
194432,,113,A,"530190              ",,,Abstieg und Polarisierung: Soziologie in Krisendebatten (ÜWP),,2.0,20221,,,J,2022-02-16 09:02:01.272,,,,,,,,,,0,4,,N,,J,,1,,,,,,,,,,,,,1
194436,,113,A,"530220              ",,,Pro-migrantischer Protest: Solidarität und Aushandlung umkämpfter Teilhabe #BIM (ÜWP),,2.0,20221,,,J,2022-02-16 11:07:19.276,,,,,,,,,,0,4,,N,,J,,1,,,,,,,,,,,,,1
194429,,113,A,"530170              ",,,Queer Feminist Issues in Methodologies and Social Science Research (ÜWP),,2.0,20221,,,J,2022-02-16 11:07:52.413,,,,,,,,,,0,4,,J,,J,,2,,,,,,,,,,,,,1
194346,,113,A,"5220053Ü            ",,,Einführung in die Feldforschung,,2.0,20221,,,J,2022-02-04 13:27:40.640,,,,,,,,,,0,4,,N,,J,,1,,,,,,,,,,,,,1
194441,,113,A,"530178              ",,,Advanced Theories of Policy Making (ÜWP),,2.0,20221,,,J,2022-02-16 10:49:44.863,,,,,,,,,,0,4,,N,,J,,2,,,,,,,,,,,,,1
194443,,113,A,"530192              ",,,Aktuelle Literatur im Bereich Theorie der Politik (ÜWP),,2.0,20221,,,J,2022-02-16 10:50:42.823,,,,,,,,,,0,4,,,,J,,1,,,,,,,,,,,,,1
194446,,113,A,"530174              ",,,Judiciary and Democratic Erosion (ÜWP),,2.0,20221,,,J,2022-02-16 10:32:21.102,,,,,,,,,,0,4,,N,,J,,2,,,,,,,,,,,,,1
194447,,113,A,"530176              ",,,Democracy and the People (ÜWP),,2.0,20221,,,J,2022-02-18 12:57:40.806,,,,,,,,,,0,4,,N,,J,,2,,,,,,,,,,,,,1
194338,,236,A,"5220006Ü            ",,,Überblick über die Sprachgeschichte des Deutschen,,2.0,20221,,,J,2022-02-20 20:06:56.690,,,,,,,,,,0,4,,N,,J,,1,,,,,,,,,,,,,2
194451,,429,A,"21811704            ",,,Schizophrenie und digitale Kommunikation,,2.0,20221,,,J,2022-02-14 10:45:40.366,,,,,,,,,,0,4,,J,,J,,1,,,,,,,,,,,,J,2
194452,,384,A,"5250201             ",,,Institutsaustausch,,2.0,20221,,,J,2022-02-14 10:51:51.496,,,,,,,,,,1,4,,N,,N,,1,,,,,,,,,,,,J,4
194339,,236,A,"5220031Ü            ",,,Einführung in die Variationslinguistik,,2.0,20221,,,J,2022-02-04 11:07:30.635,,,,,,,,,,0,4,,N,,J,,1,,,,,,,,,,,,,1
194454,,330,A,"53863               ",,,Tutorium I: Lektürekurs Gender Studies,,2.0,20221,,,J,2022-02-14 13:46:44.580,,,,,,,,,,2,4,,N,,J,,1,,,,,,,,,,,,J,1
194456,,363,A,"3314511             ",,,Klasse 8g,,2.0,20221,,,J,2022-02-14 13:55:47.608,,,,,,,,,,1,4,,N,,N,,1,,,,,,,,,,,,J,1
194457,,330,A,"53862               ",,,Tutorium II: Lektürekurs Gender Studies,,2.0,20221,,,J,2022-02-14 14:07:54.750,,,,,,,,,,1,4,,N,,J,,1,,,,,,,,,,,,J,1
194458,,330,A,"53861               ",,,Tutorium III: Wie schreibe ich eine wissenschaftliche Arbeit?,,2.0,20221,,,J,2022-02-14 14:14:49.110,,,,,,,,,,2,4,,N,,J,,1,,,,,,,,,,,,J,1
194459,,330,A,"53980               ",,,Transdisziplinär studieren in den Gender Studies,,2.0,20221,,,J,2022-02-14 14:21:56.420,,,,,,,,,,2,4,,N,,J,,1,,,,,,,,,,,,J,1
194461,,357,A,"5250202             ",,,Student Conference,,2.0,20221,,,J,2022-02-14 15:27:32.840,,,,,,,,,,1,4,,N,,N,,1,,,,,,,,,,,,J,4
194464,,353,A,"3314515             ",,,Repetitorium - Schulstoff,,12.0,20221,,,J,2022-02-15 11:03:36.756,,,,,,,,,,,4,,N,,J,,1,,,,,,,,,,,,J,1
194467,,332,A,"53520               ",,,gnuHU/ FLOSS-Werkstatt,,2.0,20221,,,J,2022-02-21 17:47:41.860,,,,,,,,,,,4,,J,,J,,1,,,,,,,,,,,,J,1
194468,,407,A,,,,"Vorlesung Höltgen, falls Präsenz",,2.0,20221,,,N,2022-02-15 13:10:52.314,,,,,,,,,,,5,,J,,N,,1,,,,,,,,,,,,J,1
194469,,236,A,"331120220091        ",,,Fachdidaktik und Lehr-/Lernforschung Chemie  (FLC) Grundschule,,2.0,20221,,,J,2022-02-15 16:14:40.719,,,,,,,,,,0,4,,J,,J,,1,,,,,,,,,,,,J,3
194470,,113,A,"331120220091        ",,,Fachdidaktik und Lehr-/Lernforschung Chemie  (FLC) Grundschule,,2.0,20221,,,J,2022-02-15 16:14:43.215,,,,,,,,,,0,4,,J,,J,,1,,,,,,,,,,,,J,3
189587,,335,A,"10414               ",,,Prüfungssimulation Strafrecht,,0.125,20221,,,J,2022-02-15 17:45:51.280,,,,,,,,,https://moodle.hu-berlin.de/course/view.php?id=110454,2,4,,N,,N,,1,,,,,,,,,,,,,1
189608,,336,A,"10439               ",,,Klausur im Strafrecht 4,,0.5,20221,,,J,2022-02-15 17:46:21.634,,,,,,,,,https://moodle.hu-berlin.de/course/view.php?id=110450,2,4,,N,,N,,1,,,,,,,,,,,,,1
189609,,336,A,"10440               ",,,Klausur im Zivilrecht 9,,0.5,20221,,,J,2022-02-15 17:46:21.642,,,,,,,,,https://moodle.hu-berlin.de/course/view.php?id=110450,2,4,,N,,N,,1,,,,,,,,,,,,,1
189613,,336,A,"10441               ",,,Klausur im Öffentlichen Recht 9,,0.5,20221,,,J,2022-02-15 17:46:21.648,,,,,,,,,https://moodle.hu-berlin.de/course/view.php?id=110450,2,4,,N,,N,,1,,,,,,,,,,,,,1
189614,,336,A,"10442               ",,,Klausur im Zivilrecht 10,,0.5,20221,,,J,2022-02-15 17:46:21.655,,,,,,,,,https://moodle.hu-berlin.de/course/view.php?id=110450,2,4,,N,,N,,1,,,,,,,,,,,,,1
189615,,336,A,"10443               ",,,Klausur im Öffentlichen Recht 10,,0.5,20221,,,J,2022-02-15 17:46:21.661,,,,,,,,,https://moodle.hu-berlin.de/course/view.php?id=110450,2,4,,N,,N,,1,,,,,,,,,,,,,1
189610,,336,A,"10444               ",,,Klausur im Strafrecht 5,,0.5,20221,,,J,2022-02-15 17:46:21.668,,,,,,,,,https://moodle.hu-berlin.de/course/view.php?id=110450,2,4,,N,,N,,1,,,,,,,,,,,,,1
194442,,113,A,"530187              ",,,Policing and Social Structure (ÜWP),,2.0,20221,,,J,2022-02-16 10:12:53.516,,,,,,,,,,0,4,,N,,J,,2,,,,,,,,,,,,,1
194424,,113,A,"530175              ",,,Digitaler Aktivismus und Vernetzung (ÜWP),,2.0,20221,,,J,2022-02-16 10:57:47.323,,,,,,,,,,0,4,,N,,J,,1,,,,,,,,,,,,,1
194445,,113,A,"530221              ",,,"Die unendliche Geschichte Ostdeutschlands - Differenz, Identität und Othering der neuen Bundesländer #BIM (ÜWP)",,2.0,20221,,,J,2022-02-16 10:20:58.327,,,,,,,,,,0,4,,N,,J,,1,,,,,,,,,,,,,1
194444,,113,A,"530183              ",,,"Die Norm kennt kein Außen. Norm, Normierung und Normalisierung und ihre soziale Wirkmächtigkeit (ÜWP)",,2.0,20221,,,J,2022-02-16 10:56:11.413,,,,,,,,,,0,4,,J,,J,,1,,,,,,,,,,,,,1
194434,,113,A,"530209              ",,,Mapping social inequalities: Introduction to GIS software and spatial data (ÜWP),,2.0,20221,,,J,2022-02-16 11:04:27.985,,,,,,,,,,0,4,,N,,J,,1,,,,,,,,,,,,,1
194450,,113,A,"530102              ",,,Die Vergesellschaftung von Natur und Religion am Beispiel von muslimisch-ökologischen Initiativen und Bewegungen in Europa (ÜWP),,2.0,20221,,,J,2022-02-16 10:57:23.209,,,,,,,,,,0,4,,N,,J,,1,,,,,,,,,,,,,1
194431,,113,A,"530186              ",,,"Growth, Inequality and Poverty (ÜWP)",,2.0,20221,,,J,2022-02-16 11:00:21.326,,,,,,,,,,0,4,,N,,J,,2,,,,,,,,,,,,,2
194430,,113,A,"530180              ",,,Kapital und Care. Feministisch-materialistische Perspektiven auf die gesellschaftliche Organisation der Arbeit (ÜWP),,2.0,20221,,,J,2022-02-16 11:00:49.673,,,,,,,,,,0,4,,J,,J,,1,,,,,,,,,,,,,2
194439,,113,A,"530214              ",,,Literatur und Gesellschaft (ÜWP),,2.0,20221,,,J,2022-02-16 11:02:18.393,,,,,,,,,,0,4,,N,,J,,1,,,,,,,,,,,,,1
194425,,113,A,"530179              ",,,Liberal Democracy & Islamic Fundamentalism (ÜWP),,2.0,20221,,,J,2022-02-16 11:02:07.103,,,,,,,,,,0,4,,N,,J,,1,,,,,,,,,,,,,3
192465,,113,A,"530214              ",,,Literatur und Gesellschaft,,2.0,20221,,,J,2022-02-16 11:02:12.441,,,,,,,,,,0,4,,N,,J,,1,,,,,,,,,,,,J,1
194448,,113,A,"530182              ",,,Political Economy of Conflict (ÜWP),,2.0,20221,,,J,2022-02-16 11:06:15.200,,,,,,,,,,0,4,,N,,J,,2,,,,,,,,,,,,,2
194449,,113,A,"530188              ",,,"The crisis of the Islamic world: democracy, human rights, political violence, and economic growth (ÜWP)",,2.0,20221,,,J,2022-02-16 11:12:00.172,,,,,,,,,,0,4,,J,,J,,2,,,,,,,,,,,,,2
194435,,113,A,"530213              ",,,Sociology of Architecture (ÜWP),,2.0,20221,,,J,2022-02-16 11:08:27.459,,,,,,,,,,0,4,,N,,J,,2,,,,,,,,,,,,,1
194423,,113,A,"530166              ",,,Verschwörungstheorien als eine Gefahr für die Demokratie? (ÜWP),,2.0,20221,,,J,2022-02-16 11:22:39.795,,,,,,,,,,0,4,,N,,J,,1,,,,,,,,,,,,,2
194440,,113,A,"530231              ",,,Voice and Embodyment (ÜWP),,2.0,20221,,,J,2022-02-16 11:23:13.300,,,,,,,,,,0,4,,N,,J,,2,,,,,,,,,,,,,1
194364,,236,A,"10520               ",,,Privates Baurecht und Vertragsgestaltung,,2.0,20221,,,J,2022-02-08 14:55:24.517,,,,,,,,,https://moodle.hu-berlin.de/course/view.php?id=110544,,4,,N,,N,,1,,,,,,,,,,,,,1
194471,,429,A,"21811705            ",,,Soziale Lebensmittelinnovationen in der Stadt: Implikationen für die Lebensmitteldemokratie,,2.0,20221,,,J,2022-02-16 13:12:09.561,,,,,,,,,,0,4,,J,,J,,9,,,,,,,,,,,,J,3
194401,,332,A,"53971               ",,,"Geschlechterverhältnisse, Rassifizierung und Rassenideologien im deutschen Kolonialismus. Strukturen, Diskurse, Kontinuitäten",,2.0,20221,,,J,2022-03-09 16:24:32.516,,,,,,,,,,0,4,,N,,N,,1,,,,,,,,,,,,J,1
194481,,332,A,"0212033             ",,,Geschichte erzählen - vom Aufsatz zur Ausstellung,,2.0,20221,,,J,2022-02-28 13:57:38.776,,,,,,,,,,0,4,,J,,N,,1,,,,,,,,,,,,,3
194474,,339,A,"0212022             ",,,Sex and the City. Geschichte der Sexualität(en) in Berlin,,2.0,20221,,,J,2022-02-28 14:07:41.379,,,,,,,,,,0,4,,J,,N,,1,,,,,,,,,,,,,4
194475,,332,A,"0212027             ",,,"Reparatur, Brüche, Teilungen. Die Gegenwarten und Geschichten des Gropius Bau",,2.0,20221,,,J,2022-02-28 14:01:43.132,,,,,,,,,,0,4,,J,,N,,1,,,,,,,,,,,,J,4
194476,,332,A,"0212028             ",,,Wissenschaftskommunikation in den Geowissenschaften - Praxisbeispiel Wissenschaftsjahr 2022,,2.0,20221,,,J,2022-02-28 14:02:13.334,,,,,,,,,,0,4,,J,,N,,1,,,,,,,,,,,,J,4
194479,,332,A,"0212030             ",,,"Surrealismus: Wort, Bild, Kritik",,2.0,20221,,,J,2022-02-28 14:03:55.817,,,,,,,,,,0,4,,N,,N,,1,,,,,,,,,,,,J,4
194480,,332,A,"0212031             ",,,Social-ecological movements and institutional transformation for environmental justice: a comparative case study analysis,,2.0,20221,,,J,2022-02-28 14:05:10.665,,,,,,,,,,0,4,,N,,N,,2,,,,,,,,,,,,J,2
194482,,332,A,"0212026             ",,,"#UniToo? Sexualisierte Belästigung, Diskriminierung und Gewalt an Berliner Hochschulen",,2.0,20221,,,J,2022-02-28 14:00:52.780,,,,,,,,,,0,4,,J,,N,,1,,,,,,,,,,,,,4
194554,,236,A,"331120220152        ",,,Statistische Thermodynamik und reale Festkörper,,3.0,20221,,,J,2022-02-18 18:45:30.591,,,,,,,,,,2,4,,J,,J,,1,,,,,,,,,,,,J,3
194505,,113,A,"331120220044        ",,,Allgemeine und Anorganische Chemie (AAC),,2.0,20221,,,J,2022-02-18 18:38:26.296,,,,,,,,,http://moodle.hu-berlin.de/course/view.php?id=110088,1,4,,J,,J,,1,,,,,,,,,,,,J,3
194485,,429,A,"21811706            ",,,The Bittersweet Symphony Between Science and Philosophy: A Never-Ending Dialogue,,2.0,20221,,,J,2022-02-18 10:52:32.411,,,,,,,,,,0,4,,J,,J,,2,,,,,,,,,,,,J,2
194486,,401,A,"5328400             ",,,Techno Culture. Geschichte und Gegenwart elektronischer Tanzmusikkultur in Berlin,,2.0,20221,,,J,2022-02-28 20:58:42.937,,,,,,,,,,0,4,,N,,N,,1,,,,,,,,,,,,,1
189946,,363,A,"3314473             ",,,Klasse 5/6a,,2.0,20221,,,J,2021-10-04 14:00:02.795,,,,,,,,,,1,4,,N,,N,,1,,,,,,,,,,,,J,1
194487,,4,A,Ü53247              ,,,Ausstellungsplanung und Museumsdidaktik: Wir erstellen Konzepte und Katalog für eine multimediale Ausstellung,,2.0,20221,,,J,2022-02-18 11:34:39.968,,,,,,,,,,0,4,,N,,J,,1,,,,,,,,,,,,,3
194488,,236,A,Ü53248              ,,,Archäologische Museen in Deutschland,,2.0,20221,,,J,2022-02-18 11:36:11.940,,,,,,,,,,0,4,,N,,J,,1,,,,,,,,,,,,,3
194490,,236,A,"53249               ",,,Archäometrie,,2.0,20221,,,J,2022-02-18 11:42:05.170,,,,,,,,,,0,4,,N,,J,,1,,,,,,,,,,,,,3
194489,,236,A,Ü53249              ,,,Archäometrie,,2.0,20221,,,J,2022-02-18 11:44:18.886,,,,,,,,,,0,4,,N,,J,,1,,,,,,,,,,,,,3
194491,,113,A,"5220099             ",,,Der Satz,,2.0,20221,,,J,2022-02-18 11:47:49.557,,,,,,,,,,0,4,,J,,J,,1,,,,,,,,,,,,,2
194594,,113,A,"331120220189        ",,,Bioorganische Synthese/Chemische Biologie,,3.0,20221,,,J,2022-02-18 18:50:36.243,,,,,,,,,,1,4,,J,,J,,1,,,,,,,,,,,,J,3
194492,,329,A,"53260               ",,,Master- und Doktorandenkolloquium,,2.0,20221,,,J,2022-02-18 11:51:32.807,,,,,,,,,,0,4,,N,,J,,1,,,,,,,,,,,,,3
194493,,401,A,"5328810             ",,,Toxic Berlin? - Spurensuche nach den Altlasten einer Region,,2.0,20221,,,J,2022-02-28 21:12:18.935,,,,,,,,,,0,4,,J,,N,,1,,,,,,,,,,,,,1
